Code,License Type,Indicator Name,Short definition,Long definition,Source,Topic,Periodicity,Aggregation method,Statistical concept and methodology,Development relevance,Limitations and exceptions,General comments,Other notes,Notes from original source,Related source links,Related indicators,License URL
MS.MIL.TOTL.TF.ZS,CC BY-4.0,Armed forces personnel (% of total labor force),,"Armed forces personnel are active duty military personnel, including paramilitary forces if the training, organization, equipment, and control suggest they may be used to support or replace regular military forces. Labor force comprises all people who meet the International Labour Organization's definition of the economically active population.","International Institute for Strategic Studies, The Military Balance.",Public Sector: Defense & arms trade,Annual,Weighted average,"Military data on manpower represent quantitative assessment of the personnel strengths of the world's armed forces. The numbers are based on the most accurate data available to, or, on the best estimate that can be made by the International Institute for Strategic Studies (IISS) at the time of its annual publication. The IISS collects the data from national governments.

Armed forces personnel comprise all servicemen and women on full-time duty (including conscripts and long-term assignments from the Reserves). Reserve describes formations and units not fully manned or operational in peacetime, but which can be mobilized by recalling reservists in an emergency. IISS estimates of effective reservist strengths on the numbers available within five years of completing full-time service, unless there is good evidence that obligations are enforced for longer. Although paramilitary forces whose training, organization, equipment and control suggest they may be used to support or replace regular military forces, they are not included in the armed forces personnel. Home Guard units are counted as paramilitary.

Data are shown as percentage of total labor force. According to International Labour Organization (ILO armed forces occupations include all jobs held by members of the armed forces. Members of the armed forces are those personnel who are currently serving in the armed forces, including auxiliary services, whether on a voluntary or compulsory basis, and who are not free to accept civilian employment and are subject to military discipline. Included are regular members of the army, navy, air force and other military services, as well as conscripts enrolled for military training or other service for a specified period. Excluded are persons in civilian employment of government establishments concerned with defense issues; police (other than military police); customs inspectors and members of border or other armed civilian services; persons who have been temporarily withdrawn from civilian life for a short period of military training or retraining, according to national requirements, and members of military reserves not currently on active service.","Although national defense is an important function of government and security from external threats that contributes to economic development, high military expenditures for defense or civil conflicts burden the economy and may impede growth. Data on military expenditures are a rough indicator of the portion of national resources used for military activities and of the burden on the economy.

Comparisons of military spending among countries should take into account the many factors that influence perceptions of vulnerability and risk, including historical and cultural traditions, the length of borders that need defending, the quality of relations with neighbors, and the role of the armed forces in the body politic.","Data exclude personnel not on active duty, therefore they underestimate the share of the labor force working for the defense establishment. Governments rarely report the size of their armed forces, so such data typically come from intelligence sources. Unless otherwise indicated, reserves includes all reservists committed to rejoining the armed forces in an emergency, except when national reserve service obligations following conscription last almost a lifetime.",Data for some countries are based on partial or uncertain data or rough estimates.,,,,,https://datacatalog.worldbank.org/public-licenses#cc-by
MS.MIL.TOTL.P1,CC BY-4.0,"Armed forces personnel, total",,"Armed forces personnel are active duty military personnel, including paramilitary forces if the training, organization, equipment, and control suggest they may be used to support or replace regular military forces.","International Institute for Strategic Studies, The Military Balance.",Public Sector: Defense & arms trade,Annual,Sum,"Military data on manpower represent quantitative assessment of the personnel strengths of the world's armed forces. The IISS collects the data from a wide variety of sources. The numbers are based on the most accurate data available to, or on the best estimate that can be made by the International Institute for Strategic Studies (IISS) at the time of its annual publication. The current WDI indicator includes active armed forces and active paramilitary (but not reservists). Armed forces personnel comprise all servicemen and women on full-time duty, including conscripts and long-term assignments from the Reserves (“Reserve” describes formations and units not fully manned or operational in peacetime, but which can be mobilized by recalling reservists in an emergency). The indicator includes paramilitary forces. The source of the data (IISS) reports armed forces and paramilitary forces separately, however these figures are added for the purpose of computing this series. Home Guard units are counted as paramilitary.","Although national defense is an important function of government and security from external threats that contributes to economic development, high military expenditures for defense or civil conflicts burden the economy and may impede growth. Data on military expenditures are a rough indicator of the portion of national resources used for military activities and of the burden on the economy.

Comparisons of military spending among countries should take into account the many factors that influence perceptions of vulnerability and risk, including historical and cultural traditions, the length of borders that need defending, the quality of relations with neighbors, and the role of the armed forces in the body politic.","Data excludes personnel not on active duty, therefore it underestimates the share of the labor force working for the defense establishment. The cooperation of governments of all countries listed in “The Military Balance” has been sought by IISS and, in many cases, received.  However, some data in “The Military Balance” is estimated.",Data for some countries are based on partial or uncertain data or rough estimates.,,,,,https://datacatalog.worldbank.org/public-licenses#cc-by
MS.MIL.XPRT.KD,CC BY-4.0,Arms exports (SIPRI trend indicator values),,"Arms transfers cover the supply of military weapons through sales, aid, gifts, and those made through manufacturing licenses. Data cover major conventional weapons such as aircraft, armored vehicles, artillery, radar systems, missiles, and ships designed for military use. Excluded are transfers of other military equipment such as small arms and light weapons, trucks, small artillery, ammunition, support equipment, technology transfers, and other services. Figures are SIPRI Trend Indicator Values (TIVs) expressed in US$ m.  A '0' indicates that the value of deliveries is less than US$0.5m","Stockholm International Peace Research Institute (SIPRI), Arms Transfers Programme (http://portal.sipri.org/publications/pages/transfer/splash).",Public Sector: Defense & arms trade,Annual,Sum,"Stockholm International Peace Research Institute (SIPRI)'s Arms Transfers Program collects data on arms transfers from open sources. Since publicly available information is inadequate for tracking all weapons and other military equipment, SIPRI covers only what it terms major conventional weapons. Data cover the supply of weapons through sales, aid, gifts, and manufacturing licenses; therefore the term arms transfers rather than arms trade is used. SIPRI data also cover weapons supplied to or from rebel forces in an armed conflict as well as arms deliveries for which neither the supplier nor the recipient can be identified with acceptable certainty; these data are available in SIPRI's database.

Data cover major conventional weapons such as aircraft, armored vehicles, artillery, radar systems and other sensors, missiles, and ships designed for military use as well as some major components such as turrets for armored vehicles and engines. Excluded are other military equipment such as most small arms and light weapons, trucks, small artillery, ammunition, support equipment, technology transfers, and other services.","Although national defense is an important function of government and security from external threats that contributes to economic development, high military expenditures for defense or civil conflicts burden the economy and may impede growth. Data on military expenditures are a rough indicator of the portion of national resources used for military activities and of the burden on the economy.

Comparisons of military spending among countries should take into account the many factors that influence perceptions of vulnerability and risk, including historical and cultural traditions, the length of borders that need defending, the quality of relations with neighbors, and the role of the armed forces in the body politic.","SIPRI calculates the volume of transfers to, from and between all parties using the TIV and the number of weapon systems or subsystems delivered in a given year. This data is intended to provide a common unit to allow the measurement if trends in the flow of arms to particular countries and regions over time. Therefore, the main priority is to ensure that the TIV system remains consistent over time, and that any changes introduced are backdated.

SIPRI TIV figures do not represent sales prices for arms transfers. They should therefore not be directly compared with gross domestic product (GDP), military expenditure, sales values or the financial value of export licences in an attempt to measure the economic burden of arms imports or the economic benefits of exports. They are best used as the raw data for calculating trends in international arms transfers over periods of time, global percentages for suppliers and recipients, and percentages for the volume of transfers to or from particular states.",Data for some countries are based on partial or uncertain data or rough estimates.,,"SIPRI statistical data on arms transfers relates to actual deliveries of major conventional weapons. To permit comparison between the data on such deliveries of different weapons and to identify general trends, SIPRI has developed a unique system to measure the volume of international transfers of major conventional weapons using a common unit, the trend-indicator value (TIV).
 
The TIV is based on the known unit production costs of a core set of weapons and is intended to represent the transfer of military resources rather than the financial value of the transfer. Weapons for which a production cost is not known are compared with core weapons based on: size and performance characteristics (weight, speed, range and payload); type of electronics, loading or unloading arrangements, engine, tracks or wheels, armament and materials; and the year in which the weapon was produced. A weapon that has been in service in another armed force is given a value 40 per cent of that of a new weapon. A used weapon that has been significantly refurbished or modified by the supplier before delivery is given a value of 66 per cent of that of a new weapon.",,,https://datacatalog.worldbank.org/public-licenses#cc-by
MS.MIL.MPRT.KD,CC BY-4.0,Arms imports (SIPRI trend indicator values),,"Arms transfers cover the supply of military weapons through sales, aid, gifts, and those made through manufacturing licenses. Data cover major conventional weapons such as aircraft, armored vehicles, artillery, radar systems, missiles, and ships designed for military use. Excluded are transfers of other military equipment such as small arms and light weapons, trucks, small artillery, ammunition, support equipment, technology transfers, and other services. Figures are SIPRI Trend Indicator Values (TIVs) expressed in US$ m. A '0' indicates that the value of deliveries is less than US$0.5m.","Stockholm International Peace Research Institute (SIPRI), Arms Transfers Programme (http://portal.sipri.org/publications/pages/transfer/splash).",Public Sector: Defense & arms trade,Annual,Sum,"Stockholm International Peace Research Institute (SIPRI)'s Arms Transfers Program collects data on arms transfers from open sources. Since publicly available information is inadequate for tracking all weapons and other military equipment, SIPRI covers only what it terms major conventional weapons. Data cover the supply of weapons through sales, aid, gifts, and manufacturing licenses; therefore the term arms transfers rather than arms trade is used. SIPRI data also cover weapons supplied to or from rebel forces in an armed conflict as well as arms deliveries for which neither the supplier nor the recipient can be identified with acceptable certainty; these data are available in SIPRI's database.

Data cover major conventional weapons such as aircraft, armored vehicles, artillery, radar systems and other sensors, missiles, and ships designed for military use as well as some major components such as turrets for armored vehicles and engines. Excluded are other military equipment such as most small arms and light weapons, trucks, small artillery, ammunition, support equipment, technology transfers, and other services.","Although national defense is an important function of government and security from external threats that contributes to economic development, high military expenditures for defense or civil conflicts burden the economy and may impede growth. Data on military expenditures are a rough indicator of the portion of national resources used for military activities and of the burden on the economy.

Comparisons of military spending among countries should take into account the many factors that influence perceptions of vulnerability and risk, including historical and cultural traditions, the length of borders that need defending, the quality of relations with neighbors, and the role of the armed forces in the body politic.","SIPRI calculates the volume of transfers to, from and between all parties using the TIV and the number of weapon systems or subsystems delivered in a given year. This data is intended to provide a common unit to allow the measurement if trends in the flow of arms to particular countries and regions over time. Therefore, the main priority is to ensure that the TIV system remains consistent over time, and that any changes introduced are backdated.

SIPRI TIV figures do not represent sales prices for arms transfers. They should therefore not be directly compared with gross domestic product (GDP), military expenditure, sales values or the financial value of export licences in an attempt to measure the economic burden of arms imports or the economic benefits of exports. They are best used as the raw data for calculating trends in international arms transfers over periods of time, global percentages for suppliers and recipients, and percentages for the volume of transfers to or from particular states.",Data for some countries are based on partial or uncertain data or rough estimates.,,"SIPRI statistical data on arms transfers relates to actual deliveries of major conventional weapons. To permit comparison between the data on such deliveries of different weapons and to identify general trends, SIPRI has developed a unique system to measure the volume of international transfers of major conventional weapons using a common unit, the trend-indicator value (TIV).
 
The TIV is based on the known unit production costs of a core set of weapons and is intended to represent the transfer of military resources rather than the financial value of the transfer. Weapons for which a production cost is not known are compared with core weapons based on: size and performance characteristics (weight, speed, range and payload); type of electronics, loading or unloading arrangements, engine, tracks or wheels, armament and materials; and the year in which the weapon was produced. A weapon that has been in service in another armed force is given a value 40 per cent of that of a new weapon. A used weapon that has been significantly refurbished or modified by the supplier before delivery is given a value of 66 per cent of that of a new weapon.",,,https://datacatalog.worldbank.org/public-licenses#cc-by
VC.BTL.DETH,CC BY-4.0,Battle-related deaths (number of people),"Battle-related deaths are deaths in battle-related conflicts between warring parties, usually involving armed forces. This includes traditional battlefield fighting, guerrilla activities, and all kinds of bombardments of military units, cities, and villages, etc. All deaths--military as well as civilian--incurred in such situations, are counted as battle-related deaths.","Battle-related deaths are deaths in battle-related conflicts between warring parties in the conflict dyad (two conflict units that are parties to a conflict). Typically, battle-related deaths occur in warfare involving the armed forces of the warring parties. This includes traditional battlefield fighting, guerrilla activities, and all kinds of bombardments of military units, cities, and villages, etc. The targets are usually the military itself and its installations or state institutions and state representatives, but there is often substantial collateral damage in the form of civilians being killed in crossfire, in indiscriminate bombings, etc. All deaths--military as well as civilian--incurred in such situations, are counted as battle-related deaths.","Uppsala Conflict Data Program, http://www.pcr.uu.se/research/ucdp/.",Public Sector: Conflict & fragility,Annual,Sum,"During warfare, targets are usually the military and its installations or state institutions and state representatives, but there is often substantial collateral damage of civilians killed in crossfire, indiscriminate bombings, and other military activities. All deaths - civilian as well as military - incurred in such situations are counted as battle-related deaths.","According to the Geneva Declaration on Armed Violence and Development, more than 526,000 people die each year because of the violence associated with armed conflict and large- and small-scale criminality. Recovery and rebuilding can take years, and the challenges are numerous: infrastructure to be rebuilt, persistently high crime, widespread health problems, education systems in disrepair, and unexploded ordnance to be cleared.

Most countries emerging from conflict lack the capacity to rebuild the economy. Thus, capacity building is one of the first tasks for restoring growth and is linked to building peace and creating the conditions that lead to sustained poverty reduction. UN Peacekeepers serve in some of the most difficult and dangerous situations around the globe. United Nations Peacekeeping force, comprised of civilian, police and military personnel, helps countries torn by conflict create the conditions for lasting peace. In addition to maintaining peace and security, peacekeepers are increasingly charged with assisting in political processes; reforming judicial systems; training law enforcement and police forces; disarming and reintegrating former combatants; supporting the return of internally displaced persons and refugees.

The World Bank and other international development agencies can help, but countries with fragile situations have to build their own institutions tailored to their own needs. Peacekeeping operations in post-conflict situations have been effective in reducing the risks of reversion to conflict.","An armed conflict is a contested incompatibility that concerns a government or territory where the use of armed force between two parties (one of them the government) results in at least 25 battle related deaths in a calendar year. 

Data is from the Uppsala Conflict Data Program (UCDP) Battle-Related Deaths Dataset which focuses on the incompatibility and lists the country, as well as the battle location and territory where battle-related deaths are reported. When more than one country is listed in the dataset, the assignment of battle-related deaths is determined by the battle location. User can refer to the ICDP dataset where they have split the deaths for the actual location of the fighting when the fighting occurred on the disputed border.",,,,,,https://datacatalog.worldbank.org/public-licenses#cc-by
GC.DOD.TOTL.GD.ZS,CC BY-4.0,"Central government debt, total (% of GDP)",,"Debt is the entire stock of direct government fixed-term contractual obligations to others outstanding on a particular date. It includes domestic and foreign liabilities such as currency and money deposits, securities other than shares, and loans. It is the gross amount of government liabilities reduced by the amount of equity and financial derivatives held by the government. Because debt is a stock rather than a flow, it is measured as of a given date, usually the last day of the fiscal year.","International Monetary Fund, Government Finance Statistics Yearbook and data files, and World Bank and OECD GDP estimates.",Public Sector: Government finance: Deficit & financing,Annual,Weighted average,"The IMF's Government Finance Statistics Manual 2014, harmonized with the 2008 SNA, recommends an accrual accounting method, focusing on all economic events affecting assets, liabilities, revenues, and expenses, not just those represented by cash transactions. It accounts for all changes in stocks, so stock data at the end of an accounting period equal stock data at the beginning of the period plus flows over the period. The 1986 manual considered only debt stocks.

Government finance statistics are reported in local currency. Many countries report government finance data by fiscal year; see country metadata for information on fiscal year end by country.",,"For most countries central government finance data have been consolidated into one account, but for others only budgetary central government accounts are available. Countries reporting budgetary data are noted in the country metadata. Because budgetary accounts may not include all central government units (such as social security funds), they usually provide an incomplete picture. In federal states the central government accounts provide an incomplete view of total public finance.

Data on government revenue and expense are collected by the IMF through questionnaires to member countries and by the Organisation for Economic Co-operation and Development (OECD). Despite IMF efforts to standardize data collection, statistics are often incomplete, untimely, and not comparable across countries.",,,,,,https://datacatalog.worldbank.org/public-licenses#cc-by
GC.DOD.TOTL.CN,CC BY-4.0,"Central government debt, total (current LCU)",,"Debt is the entire stock of direct government fixed-term contractual obligations to others outstanding on a particular date. It includes domestic and foreign liabilities such as currency and money deposits, securities other than shares, and loans. It is the gross amount of government liabilities reduced by the amount of equity and financial derivatives held by the government. Because debt is a stock rather than a flow, it is measured as of a given date, usually the last day of the fiscal year.","International Monetary Fund, Government Finance Statistics Yearbook and data files.",Public Sector: Government finance: Deficit & financing,Annual,,"The IMF's Government Finance Statistics Manual 2014, harmonized with the 2008 SNA, recommends an accrual accounting method, focusing on all economic events affecting assets, liabilities, revenues, and expenses, not just those represented by cash transactions. It accounts for all changes in stocks, so stock data at the end of an accounting period equal stock data at the beginning of the period plus flows over the period. The 1986 manual considered only debt stocks.

Government finance statistics are reported in local currency. Many countries report government finance data by fiscal year; see country metadata for information on fiscal year end by country.",,"For most countries central government finance data have been consolidated into one account, but for others only budgetary central government accounts are available. Countries reporting budgetary data are noted in the country metadata. Because budgetary accounts may not include all central government units (such as social security funds), they usually provide an incomplete picture. In federal states the central government accounts provide an incomplete view of total public finance.

Data on government revenue and expense are collected by the IMF through questionnaires to member countries and by the Organisation for Economic Co-operation and Development (OECD). Despite IMF efforts to standardize data collection, statistics are often incomplete, untimely, and not comparable across countries.",,,,,,https://datacatalog.worldbank.org/public-licenses#cc-by
