VC.IHR.PSRC.MA.P5,CC BY-4.0,"Intentional homicides, male (per 100,000 male)",,"Intentional homicides, male are estimates of unlawful male homicides purposely inflicted as a result of domestic disputes, interpersonal violence, violent conflicts over land resources, intergang violence over turf or control, and predatory violence and killing by armed groups. Intentional homicide does not include all intentional killing; the difference is usually in the organization of the killing. Individuals or small groups usually commit homicide, whereas killing in armed conflict is usually committed by fairly cohesive groups of up to several hundred members and is thus usually excluded.",UN Office on Drugs and Crime's International Homicide Statistics database.,Public Sector: Conflict & fragility,Annual,,"The definitions used to produce data are in line with the homicide definition used in the UNODC Homicide Statistics dataset. On the basis of these selection criteria and subject to data availability, a long and continuous time series including recent data on homicide counts and rates has been identified or created at country level. Data are adjusted to conform to the total number of victims of intentional homicide. The adjustment is carried out by applying the sex ratio of reported victims to the total number of victims of intentional homicide.

The intentional killing of a human being by another is the ultimate crime. Its indisputable physical consequences manifested in the form of a dead body also make it the most categorical and calculable. All existing data sources on intentional homicides, both at national and international level, stem from either criminal justice or public health systems. In the former case, data are generated by law enforcement or criminal justice authorities in the process of recording and investigating a crime event. In the latter, data are produced by health authorities certifying the cause of death of an individual.
 
Criminal justice data were collected through UNODC regular collections of crime data from Member States, through publicly available data produced by national government sources and from data compiled by other international and regional agencies, including from Interpol, Eurostat, the Organization of American States and UNICEF. Public health data on homicides were mainly derived from databases on deaths by cause disseminated by the World Health Organization (WHO).

The inclusion of recent data was given a higher priority in the selection process than the length of the time series (number of years covered). An analysis of official reports and research literature is regularly carried out to verify homicide data used by government agencies and the scientific community.

As a result of the data collection and validation process, in many countries several homicide datasets have become available from different or multiple sources. Therefore, data series have been selected to provide the most appropriate reference counts.","In some regions, organized crime, drug trafficking and the violent cultures of youth gangs are predominantly responsible for the high levels of homicide. There has been a sharp increase in homicides in some countries, particularly in Central America, are making the activities of organized crime and drug trafficking more visible. Greater use of firearms is often associated with the illicit activities of organized criminal groups, which are often linked to drug trafficking.

Knowledge of the patterns and causes of violent crime are crucial to forming preventive strategies. Young males are the group most affected by violent crime in all regions, particularly in the Americas. Yet women of all ages are the victims of intimate partner and family-related violence in all regions and countries. Indeed, in many of them, it is within the home where a woman is most likely to be killed.

Data on intentional homicides are from the United Nations Office on Drugs and Crime (UNODC), which uses a variety of national and international sources on homicides - primarily criminal justice sources as well as public health data from the World Health Organization (WHO) and the Pan American Health Organization - and the United Nations Survey of Crime Trends and Operations of Criminal Justice Systems to present accurate and comparable statistics. The UNODC defines homicide as ""unlawful death purposefully inflicted on a person by another person."" This definition excludes deaths arising from armed conflict.","Statistics reported to the United Nations in the context of its various surveys on crime levels and criminal justice trends are incidents of victimization that have been reported to the authorities in any given country. That means that this data is subject to the problems of accuracy of all official crime data. The survey results provide an overview of trends and interrelationships between various parts of the criminal justice system to promote informed decision-making in administration, nationally and internationally.

The degree to which different societies apportion the level of culpability to acts resulting in death is also subject to variation. Consequently, the comparison between countries and regions of ""intentional homicide"", or unlawful death purposefully inflicted on a person by another person, is also a comparison of the extent to which different countries deem that a killing be classified as such, as well as the capacity of their legal systems to record it. Caution should therefore be applied when evaluating and comparing homicide data.",,,,,,https://datacatalog.worldbank.org/public-licenses#cc-by
GC.XPN.INTP.ZS,CC BY-4.0,Interest payments (% of expense),,"Interest payments include interest payments on government debt--including long-term bonds, long-term loans, and other debt instruments--to domestic and foreign residents.","International Monetary Fund, Government Finance Statistics Yearbook and data files.",Public Sector: Government finance: Expense,Annual,Median,"The IMF's Government Finance Statistics Manual 2014, harmonized with the 2008 SNA, recommends an accrual accounting method, focusing on all economic events affecting assets, liabilities, revenues, and expenses, not just those represented by cash transactions. It accounts for all changes in stocks, so stock data at the end of an accounting period equal stock data at the beginning of the period plus flows over the period. The 1986 manual considered only debt stocks.

Government finance statistics are reported in local currency. Many countries report government finance data by fiscal year; see country metadata for information on fiscal year end by country.",,"For most countries central government finance data have been consolidated into one account, but for others only budgetary central government accounts are available. Countries reporting budgetary data are noted in the country metadata. Because budgetary accounts may not include all central government units (such as social security funds), they usually provide an incomplete picture. In federal states the central government accounts provide an incomplete view of total public finance.

Data on government revenue and expense are collected by the IMF through questionnaires to member countries and by the Organisation for Economic Co-operation and Development (OECD). Despite IMF efforts to standardize data collection, statistics are often incomplete, untimely, and not comparable across countries.",,,,,,https://datacatalog.worldbank.org/public-licenses#cc-by
GC.XPN.INTP.RV.ZS,CC BY-4.0,Interest payments (% of revenue),,"Interest payments include interest payments on government debt--including long-term bonds, long-term loans, and other debt instruments--to domestic and foreign residents.","International Monetary Fund, Government Finance Statistics Yearbook and data files.",Public Sector: Government finance: Expense,Annual,Median,"The IMF's Government Finance Statistics Manual 2014, harmonized with the 2008 SNA, recommends an accrual accounting method, focusing on all economic events affecting assets, liabilities, revenues, and expenses, not just those represented by cash transactions. It accounts for all changes in stocks, so stock data at the end of an accounting period equal stock data at the beginning of the period plus flows over the period. The 1986 manual considered only debt stocks.

Government finance statistics are reported in local currency. Many countries report government finance data by fiscal year; see country metadata for information on fiscal year end by country.",,"For most countries central government finance data have been consolidated into one account, but for others only budgetary central government accounts are available. Countries reporting budgetary data are noted in the country metadata. Because budgetary accounts may not include all central government units (such as social security funds), they usually provide an incomplete picture. In federal states the central government accounts provide an incomplete view of total public finance.

Data on government revenue and expense are collected by the IMF through questionnaires to member countries and by the Organisation for Economic Co-operation and Development (OECD). Despite IMF efforts to standardize data collection, statistics are often incomplete, untimely, and not comparable across countries.",,,,,,https://datacatalog.worldbank.org/public-licenses#cc-by
GC.XPN.INTP.CN,CC BY-4.0,Interest payments (current LCU),,"Interest payments include interest payments on government debt--including long-term bonds, long-term loans, and other debt instruments--to domestic and foreign residents.","International Monetary Fund, Government Finance Statistics Yearbook and data files.",Public Sector: Government finance: Expense,Annual,,"The IMF's Government Finance Statistics Manual 2014, harmonized with the 2008 SNA, recommends an accrual accounting method, focusing on all economic events affecting assets, liabilities, revenues, and expenses, not just those represented by cash transactions. It accounts for all changes in stocks, so stock data at the end of an accounting period equal stock data at the beginning of the period plus flows over the period. The 1986 manual considered only debt stocks.

Government finance statistics are reported in local currency. Many countries report government finance data by fiscal year; see country metadata for information on fiscal year end by country.",,"For most countries central government finance data have been consolidated into one account, but for others only budgetary central government accounts are available. Countries reporting budgetary data are noted in the country metadata. Because budgetary accounts may not include all central government units (such as social security funds), they usually provide an incomplete picture. In federal states the central government accounts provide an incomplete view of total public finance.

Data on government revenue and expense are collected by the IMF through questionnaires to member countries and by the Organisation for Economic Co-operation and Development (OECD). Despite IMF efforts to standardize data collection, statistics are often incomplete, untimely, and not comparable across countries.",,,,,,https://datacatalog.worldbank.org/public-licenses#cc-by
VC.IDP.NWCV,CC BY-4.0,"Internally displaced persons, new displacement associated with conflict and violence (number of cases)",,"Internally displaced persons are defined according to the 1998 Guiding Principles (http://www.internal-displacement.org/publications/1998/ocha-guiding-principles-on-internal-displacement) as people or groups of people who have been forced or obliged to flee or to leave their homes or places of habitual residence, in particular as a result of armed conflict, or to avoid the effects of armed conflict, situations of generalized violence, violations of human rights, or natural or human-made disasters and who have not crossed an international border. ""New Displacement"" refers to the number of new cases or incidents of displacement recorded over the specified year, rather than the number of people displaced. This is done because people may have been displaced more than once.",The Internal Displacement Monitoring Centre (http://www.internal-displacement.org/),Public Sector: Conflict & fragility,Annual,Sum,"Internally displaced persons are ""persons or groups of persons who have been forced or obliged to flee or to leave their homes or places of habitual residence, in particular as a result of or in order to avoid the effects of armed conflict, situations of generalized violence, violations of human rights or natural or human-made disasters, and who have not crossed an internationally recognized state border."" Internally displaced people are often confused with refugees. Unlike refugees, internally displaced people remain under the protection of their own government, even if their reason for fleeing was similar to that of refugees. Refugees are people who have crossed an international border to find sanctuary and have been granted refugee or refugee-like status or temporary protection. For more information on methodology, please refer to the information published by IDMC: http://www.internal-displacement.org/database/","Although all persons affected by conflict and/or human rights violations suffer, displacement from one's place of residence may make the internally displaced particularly vulnerable. Following are some of the factors that are likely to increase the need for protection:
 
1) Internally displaced persons may be in transit from one place to another, may be in hiding, may be forced toward unhealthy or inhospitable environments, or face other circumstances that make them especially vulnerable.
 
2) The social organization of displaced communities may have been destroyed or damaged by the act of physical displacement; family groups may be separated or disrupted; women may be forced to assume non-traditional roles or face particular vulnerabilities. Internally displaced populations, and especially groups like children, the elderly, or pregnant women, may experience profound psychosocial distress related to displacement.
 
3) Removal from sources of income and livelihood may add to physical and psychosocial vulnerability for displaced people.
 
4) Schooling for children and adolescents may be disrupted.
 
5) Internal displacement to areas where local inhabitants are of different groups or inhospitable may increase risk to internally displaced communities; internally displaced persons may face language barriers during displacement.
 
6) The condition of internal displacement may raise the suspicions of or lead to abuse by armed combatants, or other parties to conflict.
 
7) Internally displaced persons may lack identity documents essential to receiving benefits or legal recognition; in some cases, fearing persecution, displaced persons have sometimes got rid of such documents.
 
8) According to the Internal Displacement Monitoring Centre (IDMC) tens of millions people around the world are displaced every year within their countries by conflict, human rights violations, natural disasters and climate change. Unlike refugees who cross national borders and benefit from an established system of international protection and assistance, those forcibly uprooted within their own countries, by armed conflict, large-scale development projects, systematic violations of human rights, or natural disasters, lack predictable structures of support. Internal displacement has become one of the more pressing humanitarian, human rights and security problems confronting affected countries and the international community at large.
 
Global migration patterns have become increasingly complex in modern times, involving not just refugees, but also millions of economic migrants. But refugees and migrants, even if they often travel in the same way, are fundamentally different, and for that reason are treated very differently under modern international law. Migrants, especially economic migrants, choose to move in order to improve the future prospects of themselves and their families. Refugees have to move if they are to save their lives or preserve their freedom. They have no protection from their own state - indeed it is often their own government that is threatening to persecute them. If other countries do not let them in, and do not help them once they are in, then they may be condemning them to death - or to an intolerable life in the shadows, without sustenance and without rights.","Please note that most of the figures are estimates. The definition highlights two issues:

1) The coercive or otherwise involuntary character of movement. The definition mentions some of the most common causes of involuntary movements, such as armed conflict, violence, human rights violations and disasters. These causes have in common that they give no choice to people but to leave their homes and deprive them of the most essential protection mechanisms, such as community networks, access to services, livelihoods. Displacement severely affects the physical, socio-economic and legal safety of people and should be systematically regarded as an indicator of potential vulnerability.
 
2) The fact that such movement takes place within national borders. Unlike refugees, who have been deprived of the protection of their state of origin, IDPs remain legally under the protection of national authorities of their country of habitual residence. IDPs should therefore enjoy the same rights as the rest of the population. The Guiding Principles on Internal Displacement remind national authorities and other relevant actors of their responsibility to ensure that IDPs' rights are respected and fulfilled, despite the vulnerability generated by their displacement.",,,,,,https://datacatalog.worldbank.org/public-licenses#cc-by
VC.IDP.NWDS,CC BY-4.0,"Internally displaced persons, new displacement associated with disasters (number of cases)",,"Internally displaced persons are defined according to the 1998 Guiding Principles (http://www.internal-displacement.org/publications/1998/ocha-guiding-principles-on-internal-displacement) as people or groups of people who have been forced or obliged to flee or to leave their homes or places of habitual residence, in particular as a result of armed conflict, or to avoid the effects of armed conflict, situations of generalized violence, violations of human rights, or natural or human-made disasters and who have not crossed an international border. ""New Displacement"" refers to the number of new cases or incidents of displacement recorded over the specified year, rather than the number of people displaced. This is done because people may have been displaced more than once.",The Internal Displacement Monitoring Centre (http://www.internal-displacement.org/),Public Sector: Conflict & fragility,Annual,Sum,"Internally displaced persons are ""persons or groups of persons who have been forced or obliged to flee or to leave their homes or places of habitual residence, in particular as a result of or in order to avoid the effects of armed conflict, situations of generalized violence, violations of human rights or natural or human-made disasters, and who have not crossed an internationally recognized state border."" Internally displaced people are often confused with refugees. Unlike refugees, internally displaced people remain under the protection of their own government, even if their reason for fleeing was similar to that of refugees. Refugees are people who have crossed an international border to find sanctuary and have been granted refugee or refugee-like status or temporary protection.","Although all persons affected by conflict and/or human rights violations suffer, displacement from one's place of residence may make the internally displaced particularly vulnerable. Following are some of the factors that are likely to increase the need for protection:
 
1) Internally displaced persons may be in transit from one place to another, may be in hiding, may be forced toward unhealthy or inhospitable environments, or face other circumstances that make them especially vulnerable.
 
2) The social organization of displaced communities may have been destroyed or damaged by the act of physical displacement; family groups may be separated or disrupted; women may be forced to assume non-traditional roles or face particular vulnerabilities. Internally displaced populations, and especially groups like children, the elderly, or pregnant women, may experience profound psychosocial distress related to displacement.
 
3) Removal from sources of income and livelihood may add to physical and psychosocial vulnerability for displaced people.
 
4) Schooling for children and adolescents may be disrupted.
 
5) Internal displacement to areas where local inhabitants are of different groups or inhospitable may increase risk to internally displaced communities; internally displaced persons may face language barriers during displacement.
 
6) The condition of internal displacement may raise the suspicions of or lead to abuse by armed combatants, or other parties to conflict.
 
7) Internally displaced persons may lack identity documents essential to receiving benefits or legal recognition; in some cases, fearing persecution, displaced persons have sometimes got rid of such documents.
 
8) According to the Internal Displacement Monitoring Centre (IDMC) tens of millions people around the world are displaced every year within their countries by conflict, human rights violations, natural disasters and climate change. Unlike refugees who cross national borders and benefit from an established system of international protection and assistance, those forcibly uprooted within their own countries, by armed conflict, large-scale development projects, systematic violations of human rights, or natural disasters, lack predictable structures of support. Internal displacement has become one of the more pressing humanitarian, human rights and security problems confronting affected countries and the international community at large.
 
Global migration patterns have become increasingly complex in modern times, involving not just refugees, but also millions of economic migrants. But refugees and migrants, even if they often travel in the same way, are fundamentally different, and for that reason are treated very differently under modern international law. Migrants, especially economic migrants, choose to move in order to improve the future prospects of themselves and their families. Refugees have to move if they are to save their lives or preserve their freedom. They have no protection from their own state - indeed it is often their own government that is threatening to persecute them. If other countries do not let them in, and do not help them once they are in, then they may be condemning them to death - or to an intolerable life in the shadows, without sustenance and without rights.","Please note that most of the figures are estimates. The definition highlights two issues:

1) The coercive or otherwise involuntary character of movement. The definition mentions some of the most common causes of involuntary movements, such as armed conflict, violence, human rights violations and disasters. These causes have in common that they give no choice to people but to leave their homes and deprive them of the most essential protection mechanisms, such as community networks, access to services, livelihoods. Displacement severely affects the physical, socio-economic and legal safety of people and should be systematically regarded as an indicator of potential vulnerability.
 
2) The fact that such movement takes place within national borders. Unlike refugees, who have been deprived of the protection of their state of origin, IDPs remain legally under the protection of national authorities of their country of habitual residence. IDPs should therefore enjoy the same rights as the rest of the population. The Guiding Principles on Internal Displacement remind national authorities and other relevant actors of their responsibility to ensure that IDPs' rights are respected and fulfilled, despite the vulnerability generated by their displacement.",,,,,,https://datacatalog.worldbank.org/public-licenses#cc-by
